[
  {
    "id": "first_step",
    "name": "踏入异世界",
    "description": "完成第一局游戏",
    "icon": "🌍",
    "hidden": false,
    "condition": "age >= 1",
    "category": "进度"
  },
  {
    "id": "ten_lives",
    "name": "轮回十世",
    "description": "完成10局游戏",
    "icon": "🔄",
    "hidden": true,
    "condition": "age >= 1",
    "category": "进度"
  },
  {
    "id": "longevity",
    "name": "长寿之人",
    "description": "活到80岁",
    "icon": "🕐",
    "hidden": false,
    "condition": "age >= 80",
    "category": "人生"
  },
  {
    "id": "rags_to_riches",
    "name": "麻雀变凤凰",
    "description": "出身贫民窟，最终受封领主",
    "icon": "👑",
    "hidden": true,
    "condition": "event.count.birth_slums >= 1 & has.flag.lord",
    "category": "人生"
  },
  {
    "id": "slum_survivor",
    "name": "泥泞中绽放",
    "description": "出身贫民窟，活到70岁",
    "icon": "🌱",
    "hidden": true,
    "condition": "event.count.birth_slums >= 1 & age >= 70",
    "category": "人生"
  },
  {
    "id": "noble_born_knight",
    "name": "天生的骑士",
    "description": "贵族出身，成为骑士英雄",
    "icon": "🏰",
    "hidden": true,
    "condition": "event.count.birth_noble >= 1 & has.flag.knight_hero",
    "category": "人生"
  },
  {
    "id": "legacy_master",
    "name": "桃李满天下",
    "description": "收徒传艺并倾囊相授",
    "icon": "🎓",
    "hidden": false,
    "condition": "has.flag.has_student & has.flag.legacy_passed",
    "category": "人生"
  },
  {
    "id": "love_and_war",
    "name": "战争与爱情",
    "description": "结婚并经历战争，最终活到60岁",
    "icon": "💍",
    "hidden": true,
    "condition": "has.flag.married & has.flag.war_hero & age >= 60",
    "category": "人生"
  },
  {
    "id": "eternal_wanderer",
    "name": "永远的旅人",
    "description": "加入公会后活到60岁，却从未定居",
    "icon": "🧳",
    "hidden": true,
    "condition": "age >= 60 & has.flag.guild_member",
    "category": "人生"
  },
  {
    "id": "never_back_down",
    "name": "不屈之魂",
    "description": "被欺负后反击，最终成为英雄",
    "icon": "🔥",
    "hidden": true,
    "condition": "has.flag.bullied_child & has.flag.fight_back & has.flag.knight_hero",
    "category": "人生"
  },
  {
    "id": "merchant_lord",
    "name": "富甲一方",
    "description": "成为大商人并受封领主",
    "icon": "🏗️",
    "hidden": true,
    "condition": "has.flag.merchant_master & has.flag.lord",
    "category": "人生"
  },
  {
    "id": "loving_family",
    "name": "天伦之乐",
    "description": "结婚、生子、留下传承",
    "icon": "👨‍👩‍👧",
    "hidden": false,
    "condition": "has.flag.married & has.flag.parent & has.flag.has_successor",
    "category": "人生"
  },
  {
    "id": "widowed_hero",
    "name": "丧偶之痛",
    "description": "失去伴侣后仍然坚强地活到60岁",
    "icon": "🥀",
    "hidden": true,
    "condition": "has.flag.widowed & age >= 60",
    "category": "人生"
  },
  {
    "id": "scholar_warrior",
    "name": "文武双全",
    "description": "智慧和体魄峰值同时达到30",
    "icon": "📖⚔️",
    "hidden": true,
    "condition": "attribute.peak.str >= 30 & attribute.peak.int >= 30",
    "category": "人生"
  },
  {
    "id": "peaceful_ending",
    "name": "落叶归根",
    "description": "安详地度过晚年",
    "icon": "🍂",
    "hidden": true,
    "condition": "has.flag.peaceful_retirement & age >= 70",
    "category": "人生"
  },
  {
    "id": "knight_ascending",
    "name": "骑士之道",
    "description": "成为骑士并赢得荣耀",
    "icon": "⚔️",
    "hidden": false,
    "condition": "has.flag.knight & has.flag.knight_honor",
    "category": "路线"
  },
  {
    "id": "knight_hero_ach",
    "name": "王国之盾",
    "description": "成为骑士并率领冲锋，最终成为英雄",
    "icon": "🛡️",
    "hidden": false,
    "condition": "has.flag.knight & has.flag.knight_honor & has.flag.knight_hero",
    "category": "路线"
  },
  {
    "id": "mage_path",
    "name": "魔法学院之路",
    "description": "从入学到毕业，完成魔法师养成",
    "icon": "📚",
    "hidden": false,
    "condition": "has.flag.magic_student & has.flag.mage_graduate",
    "category": "路线"
  },
  {
    "id": "merchant_empire",
    "name": "商业帝国",
    "description": "从学徒到大商人，建立自己的商业版图",
    "icon": "💰",
    "hidden": false,
    "condition": "has.flag.merchant_apprentice & has.flag.merchant_master",
    "category": "路线"
  },
  {
    "id": "adventurer_legend",
    "name": "冒险者传说",
    "description": "加入公会、深入地下城、成为地下城大师",
    "icon": "🗺️",
    "hidden": false,
    "condition": "has.flag.guild_member & has.flag.dungeon_veteran & has.flag.dungeon_master",
    "category": "路线"
  },
  {
    "id": "tower_master_ach",
    "name": "高塔之主",
    "description": "成为魔法塔主人",
    "icon": "🗼",
    "hidden": true,
    "condition": "has.flag.tower_master",
    "category": "路线"
  },
  {
    "id": "school_founder_ach",
    "name": "教育先驱",
    "description": "创办学校，传播知识",
    "icon": "🏫",
    "hidden": false,
    "condition": "has.flag.school_founder",
    "category": "路线"
  },
  {
    "id": "dragon_slayer_ach",
    "name": "屠龙者",
    "description": "讨伐巨龙并取得胜利",
    "icon": "🐉",
    "hidden": false,
    "condition": "has.flag.dragon_slayer",
    "category": "战斗"
  },
  {
    "id": "dragon_near_death",
    "name": "龙口余生",
    "description": "在讨伐巨龙中险些丧命但活了下来",
    "icon": "💀",
    "hidden": true,
    "condition": "has.flag.near_death & has.flag.dragon_defeated & age >= 40",
    "category": "战斗"
  },
  {
    "id": "war_hero_ach",
    "name": "战争英雄",
    "description": "在战争中存活并成为英雄",
    "icon": "🎖️",
    "hidden": false,
    "condition": "has.flag.war_hero & age >= 50",
    "category": "战斗"
  },
  {
    "id": "duel_champion_ach",
    "name": "决斗冠军",
    "description": "以堂堂正正的方式赢得决斗",
    "icon": "🤺",
    "hidden": true,
    "condition": "has.flag.champion",
    "category": "战斗"
  },
  {
    "id": "demon_king_slayer_ach",
    "name": "魔王终结者",
    "description": "讨伐魔王",
    "icon": "👿",
    "hidden": true,
    "condition": "has.flag.demon_king_slayer",
    "category": "战斗"
  },
  {
    "id": "warriors_death_ach",
    "name": "战士之死",
    "description": "在战斗中壮烈牺牲",
    "icon": "⚰️",
    "hidden": true,
    "condition": "has.flag.warriors_death",
    "category": "战斗"
  },
  {
    "id": "archmage_ach",
    "name": "大贤者",
    "description": "达到魔法师的最高境界",
    "icon": "🧙",
    "hidden": false,
    "condition": "has.flag.archmage",
    "category": "魔法"
  },
  {
    "id": "forbidden_knowledge",
    "name": "禁忌的代价",
    "description": "翻开禁书但最终抵抗住了黑暗诱惑",
    "icon": "📕",
    "hidden": true,
    "condition": "has.flag.dark_path & has.flag.resist_dark",
    "category": "魔法"
  },
  {
    "id": "dark_savior",
    "name": "黑暗救赎",
    "description": "走上暗黑之路但最终逃离并活下来",
    "icon": "🕯️",
    "hidden": true,
    "condition": "has.flag.dark_embraced & has.flag.escaped_dark & age >= 50",
    "category": "魔法"
  },
  {
    "id": "elemental_lord_ach",
    "name": "元素之主",
    "description": "掌握元素魔法的至高力量",
    "icon": "🌊",
    "hidden": true,
    "condition": "has.flag.elemental_lord",
    "category": "魔法"
  },
  {
    "id": "war_mage_ach",
    "name": "战争法师",
    "description": "同时掌握武艺和魔法的战场术士",
    "icon": "⚡",
    "hidden": true,
    "condition": "has.flag.war_mage",
    "category": "魔法"
  },
  {
    "id": "iron_body",
    "name": "钢铁之躯",
    "description": "体魄峰值达到40",
    "icon": "💪",
    "hidden": false,
    "condition": "attribute.peak.str >= 40",
    "category": "属性"
  },
  {
    "id": "wisdom_peak",
    "name": "全知者",
    "description": "智慧峰值达到40",
    "icon": "👁️",
    "hidden": false,
    "condition": "attribute.peak.int >= 40",
    "category": "属性"
  },
  {
    "id": "beauty_supreme",
    "name": "绝世容颜",
    "description": "魅力峰值达到40",
    "icon": "💎",
    "hidden": false,
    "condition": "attribute.peak.chr >= 40",
    "category": "属性"
  },
  {
    "id": "archmage_body",
    "name": "魔力共鸣",
    "description": "魔力峰值达到40",
    "icon": "✨",
    "hidden": false,
    "condition": "attribute.peak.mag >= 40",
    "category": "属性"
  },
  {
    "id": "soul_pure",
    "name": "纯净灵魂",
    "description": "灵魂峰值达到40",
    "icon": "🌙",
    "hidden": false,
    "condition": "attribute.peak.spr >= 40",
    "category": "属性"
  },
  {
    "id": "lucky_star",
    "name": "天选之人",
    "description": "运势峰值达到30",
    "icon": "🌟",
    "hidden": false,
    "condition": "attribute.peak.luk >= 30",
    "category": "属性"
  },
  {
    "id": "wealth_peak",
    "name": "富可敌国",
    "description": "家境峰值达到30",
    "icon": "🪙",
    "hidden": false,
    "condition": "attribute.peak.mny >= 30",
    "category": "属性"
  },
  {
    "id": "hero_ach",
    "name": "真正的勇者",
    "description": "完成勇者之旅并拯救世界",
    "icon": "🗡️",
    "hidden": false,
    "condition": "has.flag.legendary_hero | (has.flag.kingdom_hero & has.flag.world_rebuilt)",
    "category": "史诗"
  },
  {
    "id": "dark_lord_ach",
    "name": "世界破坏者",
    "description": "走上暗黑之路并摧毁世界",
    "icon": "🌑",
    "hidden": false,
    "condition": "has.flag.dark_embraced & has.flag.world_destroyed",
    "category": "史诗"
  },
  {
    "id": "world_breaker_ach",
    "name": "终焉与新生",
    "description": "经历世界崩坏并重建文明",
    "icon": "☄️",
    "hidden": false,
    "condition": "has.flag.world_breaking & has.flag.world_rebuilt",
    "category": "史诗"
  },
  {
    "id": "dragon_knight",
    "name": "龙骑士",
    "description": "骑乘巨龙翱翔天际",
    "icon": "🐲",
    "hidden": true,
    "condition": "has.flag.dragon_rider",
    "category": "史诗"
  },
  {
    "id": "demon_slayer",
    "name": "魔族猎手",
    "description": "觉醒魔族血统并讨伐巨龙",
    "icon": "😈",
    "hidden": true,
    "condition": "has.talent.demon_heritage & has.flag.dragon_slayer",
    "category": "史诗"
  },
  {
    "id": "divine_champion_ach",
    "name": "神之代行者",
    "description": "成为神选之人并完成使命",
    "icon": "✝️",
    "hidden": true,
    "condition": "has.flag.divine_champion",
    "category": "史诗"
  },
  {
    "id": "ascended_ach",
    "name": "超越凡人",
    "description": "通过修炼超越了种族的极限",
    "icon": "🌌",
    "hidden": true,
    "condition": "has.flag.ascended | has.flag.transcendent",
    "category": "史诗"
  },
  {
    "id": "undying_legend_ach",
    "name": "不朽传说",
    "description": "你的故事将永远流传",
    "icon": "📜",
    "hidden": true,
    "condition": "has.flag.undying_legend",
    "category": "史诗"
  },
  {
    "id": "human_adaptability",
    "name": "人类的适应力",